{
  "$schema": "itest-report-v1.schema.json",
  "schema_version": 1,
  "run_id": "coverage-fixture",
  "runner_version": "0.12.0",
  "complete": true,
  "outcome": "pass",
  "environment": {
    "build_profile": "debug",
    "debug_assertions": true,
    "godot_version": "4.6.2",
    "os": "linux",
    "arch": "x86_64"
  },
  "selection": {
    "registered": 1,
    "selected": 1,
    "focus_run": false,
    "filter": null,
    "patterns": []
  },
  "repeat": 1,
  "timeout_frames": 600,
  "summary": {
    "passed": 1,
    "failed": 0,
    "flaky": 0,
    "skipped": 0,
    "total": 1,
    "attempts_passed": 1,
    "attempts_failed": 0,
    "total_duration_ms": 1.0
  },
  "tests": [
    {
      "id": "fixture-test",
      "name": "fixture_test",
      "file": "fixture.rs",
      "line": 1,
      "outcome": "pass",
      "duration_ms": 1.0,
      "attempts": [
        {
          "id": "fixture-attempt",
          "index": 1,
          "outcome": "pass",
          "duration_ms": 1.0,
          "failures": [],
          "artifacts": []
        }
      ]
    }
  ],
  "errors": [],
  "artifacts": [],
  "metadata": {}
}
